url,speeches,Dates,locations
http://www.americanrhetoric.com/speeches/gwbush2000victoryspeech.htm,"[Thank you very much. Good evening, my fellow Americans. I appreciate so very much the opportunity to speak with you tonight.Mr. Speaker, Lieutenant Governor, friends, distinguished guests, our country has been through a long and trying period, with the outcome of the presidential election not finalized for longer than any of us could ever imagine.Vice President Gore and I put our hearts and hopes into our campaigns. We both gave it our all. We shared similar emotions, so I understand how difficult this moment must be for Vice President Gore and his family.He has a distinguished record of service to our country as a congressman, a senator and a vice president.This evening I received a gracious call from the vice president. We agreed to meet early next week in Washington, and we agreed to do our best to heal our country after this hard-fought contest.Tonight I want to thank all the thousands of volunteers and campaign workers who worked so hard on my behalf.I also salute the vice president and his supports for waging a spirited campaign. And I thank him for a call that I know was difficult to make. Laura and I wish the vice president and Senator Lieberman and their families the very best.I have a lot to be thankful for tonight. I'm thankful for America and thankful that we were able to resolve our electoral differences in a peaceful way.I'm thankful to the American people for the great privilege of being able to serve as your next president.I want to thank my wife and our daughters for their love. Laura's active involvement as first lady has made Texas a better place, and she will be a wonderful first lady of America.I am proud to have Dick Cheney by my side, and America will be proud to have him as our next vice president.Tonight, I chose to speak from the chamber of the Texas House of Representatives because it has been a home to bipartisan cooperation. Here in a place where Democrats have the majority, Republicans and Democrats have worked together to do what is right for the people we represent.We've had spirited disagreements. And in the end, we found constructive consensus. It is an experience I will always carry with me, an example I will always follow.I want to thank my friend, House Speaker Pete Laney, a Democrat, who introduced me today. I want to thank the legislators from both political parties with whom I've worked. Across the hall in our Texas capitol is the state Senate. And I cannot help but think of our mutual friend, the former Democrat lieutenant governor, Bob Bullock. His love for Texas and his ability to work in a bipartisan way continue to be a model for all of us.The spirit of cooperation I have seen in this hall is what is needed in Washington, D.C. It is the challenge of our moment. After a difficult election, we must put politics behind us and work together to make the promise of America available for every one of our citizens.I'm optimistic that we can change the tone in Washington, D.C.I believe things happen for a reason, and I hope the long wait of the last five weeks will heighten a desire to move beyond the bitterness and partisanship of the recent past.Our nation must rise above a house divided. Americans share hopes and goals and values far more important than any political disagreements.Republicans want the best for our nation, and so do Democrats. Our votes may differ, but not our hopes.I know America wants reconciliation and unity. I know Americans want progress. And we must seize this moment and deliver.Together, guided by a spirit of common sense, common courtesy and common goals, we can unite and inspire the American citizens.Together, we will work to make all our public schools excellent, teaching every student of every background and every accent, so that no child is left behind.Together, we will save Social Security and renew its promise of a secure retirement for generations to come.Together, we will strengthen Medicare and offer prescription drug coverage to all of our seniors.Together, we will give Americans the broad, fair, and fiscally responsible tax relief they deserve.Together, we'll have a bipartisan foreign policy true to our values and true to our friends, and we will have a military equal to every challenge and superior to every adversary.Together, we will address some of society's deepest problems one person at a time, by encouraging and empowering the good hearts and good works of the American people.This is the essence of compassionate conservatism and it will be a foundation of my administration.These priorities are not merely Republican concerns or Democratic concerns; they are American responsibilities.During the fall campaign, we differed about the details of these proposals, but there was remarkable consensus about the important issues before us: excellent schools, retirement and health security, tax relief, a strong military, a more civil society.We have discussed our differences. Now it is time to find common ground and build consensus to make America a beacon of opportunity in the 21st century.I'm optimistic this can happen. Our future demands it and our history proves it. Two hundred years ago, in the election of 1800, America faced another close presidential election. A tie in the Electoral College put the outcome into the hands of Congress.After six days of voting and 36 ballots, the House of Representatives elected Thomas Jefferson the third president of the United States. That election brought the first transfer of power from one party to another in our new democracy.Shortly after the election, Jefferson, in a letter titled ""Reconciliation and Reform,"" wrote this: ""The steady character of our countrymen is a rock to which we may safely moor; unequivocal in principle, reasonable in manner. We should be able to hope to do a great deal of good to the cause of freedom and harmony.""Two hundred years have only strengthened the steady character of America. And so as we begin the work of healing our nation, tonight I call upon that character: respect for each other, respect for our differences, generosity of spirit, and a willingness to work hard and work together to solve any problem.I have something else to ask you, to ask every American. I ask for you to pray for this great nation. I ask for your prayers for leaders from both parties. I thank you for your prayers for me and my family, and I ask you to pray for Vice President Gore and his family.I have faith that with God's help we as a nation will move forward together as one nation, indivisible. And together we will create an America that is open, so every citizen has access to the American dream; an America that is educated, so every child has the keys to realize that dream; and an America that is united in our diversity and our shared American values that are larger than race or party.I was not elected to serve one party, but to serve one nation.The president of the United States is the president of every single American, of every race and every background.Whether you voted for me or not, I will do my best to serve your interests and I will work to earn your respect.I will be guided by President Jefferson's sense of purpose, to stand for principle, to be reasonable in manner, and above all, to do great good for the cause of freedom and harmony.The presidency is more than an honor. It is more than an office. It is a charge to keep, and I will give it my all.Thank you very much and God bless America.",['13 December 2000'],[]
http://www.americanrhetoric.com/speeches/gwbfirstinaugural.htm,"[Thank you, all., Chief Justice Rehnquist, President Carter, President Bush, President Clinton, distinguished guests and my fellow citizens:, The peaceful transfer of authority is rare in history, yet common in our country. With a simple oath, we affirm old traditions and make new beginnings. As I begin, I thank President Clinton for his service to our nation. And I thank Vice President Gore for a contest conducted with spirit and ended with grace. I am honored and humbled to stand here, where so many of America's leaders have come before me, and so many will follow. We have a place, all of us, in a long story -- a story we continue, but whose end we will not see. It is a story of a new world that became a friend and liberator of the old, a story of a slave-holding society that became a servant of freedom, the story of a power that went into the world to protect but not possess, to defend but not to conquer. It is the American story -- a story of flawed and fallible people, united across the generations by grand and enduring ideals. The grandest of these ideals is an unfolding American promise that everyone belongs, that everyone deserves a chance, that no insignificant person was ever born. Americans are called to enact this promise in our lives and in our laws. And though our nation has sometimes halted, and sometimes delayed, we must follow no other course. Through much of the last century, America's faith in freedom and democracy was a rock in a raging sea. Now it is a seed upon the wind, taking root in many nations. Our democratic faith is more than the creed of our country, it is the inborn hope of our humanity, an ideal we carry but do not own, a trust we bear and pass along. And even after nearly 225 years, we have a long way yet to travel. While many of our citizens prosper, others doubt the promise, even the justice, of our own country. The ambitions of some Americans are limited by failing schools and hidden prejudice and the circumstances of their birth. And sometimes our differences run so deep, it seems we share a continent, but not a country. We do not accept this, and we will not allow it. Our unity, our union, is the serious work of leaders and citizens in every generation. And this is my solemn pledge: I will work to build a single nation of justice and opportunity. I know this is in our reach because we are guided by a Power larger than ourselves who creates us equal in His image. And we are confident in principles that unite and lead us onward. America has never been united by blood or birth or soil. We are bound by ideals that move us beyond our backgrounds, lift us above our interests and teach us what it means to be citizens. Every child must be taught these principles. Every citizen must uphold them. And every immigrant, by embracing these ideals, makes our country more, not less, American. Today -- Today we affirm a new commitment to live out our nation's promise through civility, courage, compassion, and character. America, at its best, matches a commitment to principle with a concern for civility. A civil society demands from each of us good will and respect, fair dealing and forgiveness. Some seem to believe that our politics can afford to be petty because, in a time of peace, the stakes of our debates appear small. But the stakes for America are never small. If our country does not lead the cause of freedom, it will not be led. If we do not turn the hearts of children toward knowledge and character, we will lose their gifts and undermine their idealism. If we permit our economy to drift and decline, the vulnerable will suffer most. We must live up to the calling we share. Civility is not a tactic or a sentiment. It is the determined choice of trust over cynicism, of community over chaos. And this commitment, if we keep it, is a way to shared accomplishment. , America, at its best, is also courageous. Our national courage has been clear in times of depression and war, when defeating common dangers defined our common good. Now we must choose if the example of our fathers and mothers will inspire us or condemn us. We must show courage in a time of blessing by confronting problems instead of passing them on to future generations. Together, we will reclaim America's schools, before ignorance and apathy claim more young lives. We will reform Social Security and Medicare, sparing our children from struggles we have the power to prevent. And we'll reduce taxes, to recover the momentum of our economy and reward the effort and enterprise of working Americans. We will build our defenses beyond challenge, lest weakness invite challenge. We will confront weapons of mass destruction, so that a new century is spared new horrors. The enemies of liberty and our country should make no mistake: America remains engaged in the world by history and by choice, shaping a balance of power that favors freedom. We will defend our allies and our interests. We will show purpose without arrogance. We will meet aggression and bad faith with resolve and strength. And to all nations, we will speak for the values that gave our nation birth. America, at its best, is compassionate. In the quiet of American conscience, we know that deep, persistent poverty is unworthy of our nation's promise. And whatever our views of its cause, we can agree that children at risk are not at fault. Abandonment and abuse are not acts of God, they are failures of love. And the proliferation of prisons, however necessary, is no substitute for hope and order in our souls. Where there is suffering, there is duty. Americans in need are not strangers, they are citizens, not problems, but priorities. And all of us are diminished when any are hopeless. Government has great responsibilities for public safety and public health, for civil rights and common schools. Yet compassion is the work of a nation, not just a government. And some needs and hurts are so deep they will only respond to a mentor's touch or a pastor's prayer. Church and charity, synagogue and mosque lend our communities their humanity, and they will have an honored place in our plans and in our laws. Many in our country do not know the pain of poverty, but we can listen to those who do.And I can pledge our nation to a goal: When we see that wounded traveler on the road to Jericho, we will not pass to the other side. America, at its best, is a place where personal responsibility is valued and expected. Encouraging responsibility is not a search for scapegoats, it is a call to conscience. And though it requires sacrifice, it brings a deeper fulfillment. We find the fullness of life not only in options, but in commitments. And we find that children and community are the commitments that set us free. Our public interest depends on private character, on civic duty and family bonds and basic fairness, on -- on uncounted, unhonored acts of decency which give direction to our freedom. Sometimes in life we're called to do great things. But as a saint of our times has said, every day we are called to ""do small things with great love."", 1, The most important tasks of a democracy are done by everyone. I will live and lead by these principles: to advance my convictions with civility, to pursue the public interest with courage, to speak for greater justice and compassion, to call for responsibility and try to live it as well.In all these ways, I will bring the values of our history to the care of our times. What you do is as important as anything government does. I ask you to seek a common good beyond your comfort; to defend needed reforms against easy attacks; to serve your nation, beginning with your neighbor. I ask you to be citizens: citizens, not spectators; citizens, not subjects; responsible citizens, building communities of service and a nation of character. Americans are generous and strong and decent, not because we believe in ourselves, but because we hold beliefs beyond ourselves. When this spirit of citizenship is missing, no government program can replace it. When this spirit is present, no wrong can stand against it. After the Declaration of Independence was signed, Virginia statesman John Page wrote to Thomas Jefferson: ""We know the race is not to the swift nor the battle to the strong. Do you not think an angel rides in the whirlwind and directs this storm?"", Much time has passed since Jefferson arrived for his inauguration. The years and changes accumulate. But the themes of this day he would know: our nation's grand story of courage and its simple dream of dignity. We are not this story's Author, who fills time and eternity with His purpose. Yet His purpose is achieved in our duty, and our duty is fulfilled in service to one another. Never tiring, never yielding, never finishing, we renew that purpose today, to make our country more just and generous, to affirm the dignity of our lives and every life. This work continues. The story goes on. And an angel still rides in the whirlwind and directs this storm. God bless you all, and God bless America. ,",['20 January 2001'],[]
http://www.americanrhetoric.com/speeches/gwbushwhitehousestaffswearingin.htm,"[Thank you. Don't go overboard. Sit down, please -- no place to sit. Okay, don't sit down. Thank you all for coming. Mr. Vice President, thank you very much.Chief of Staff Card, I'm honored to have you by my side. I started work this morning and there he was, smiling and ready to go on behalf of the American people. , The First Lady and I have -- are honored to be living here and we're honored to be hosting this event, the first we've done in this glorious room since -- since the Inauguration. , I want to thank the family members who are here; thank you for your sacrifice; thank you for the long hours, accepting the long hours that your loved one is about to put in on behalf of the American people. Some of the folks that are here have worked in past Administrations. Some of us, this is a new experience. But for all of us, it is an honor of a lifetime and it is our privilege to share this together. , I am here to lead the Executive Branch of government. You all are here because you have my full confidence. And we are here with the same basic purpose: to serve the American people. We have all taken an oath, and from this moment on it is our jobs to honor it. , Today, everything is so promising and new. My hope is that the day will never come when any of us take[s] this place for granted, and this honor for granted. As we serve, we must always remember three things:, First, we must remember the high standards that come with high office. This begins with careful adherence to the rules. I expect every member of this Administration to stay well within the boundaries that define legal and ethical conduct.This means avoiding even the appearance of problems. This means checking and, if need be, double-checking that the rules have been obeyed. This means never compromising those rules. No one in the White House should be afraid to confront the people they work for, for ethical concerns. And no one should hesitate to confront me, as well. We're all accountable to one another. And above all, we're all accountable to the law and to the American people. My White House Counsel, Al Gonzalez, is my point man on these issues. If you have even a hint of ethical doubt, I urge you to talk to Al. , Second, we must remember that high standards of conduct involve not only obeying the law, but showing civility. As we go about our work there is no excuse for arrogance, and never a reason for disrespect toward others. People who work here are highly visible throughout the government. In many way -- In many of your dealings, you'll be the face and voice of the White House staff. You'll be my representative. I expect each of you, as an official of this Administration, to be an example of humility and decency and fairness. , And, finally, we must all remember that we are here for a reason. You and I and the Vice President share the same goals for our country and the same commitment to achieving them. We are here to make progress. We are not here just to mark time. The next few weeks we'll affirm the central policy goals of this Administration, beginning this week with education reform. Everyone will know where we stand. Everyone will know where we're headed. Every morning I want you to remember these goals. Every evening I want you to review the progress we have made. I want it said of us, at the end of our service, that ""promises made were promises kept."" , On a mantle piece in this Great House is inscribed the prayer of John Adams, that only the ""wise"" and ""honest"" may ""rule under this roof."", 1, He was speaking of those who live here. But wisdom and honesty are also required of those who work here. I know each of you is capable of meeting that charge. This is only our second day, but times [sic] moves fast around here. So let us begin the work we were hired to do and leave this a better place than we found it. , God bless.",['22 January 2001'],"['Washington, D.C.']"
