url,speeches,Dates,locations
http://www.americanrhetoric.com/speeches/gwbimmigrationreform.htm,"[Good evening. I've asked for a few minutes of your time to discuss a matter of national importance -- the reform of America's immigration system., The issue of immigration stirs intense emotions, and in recent weeks, Americans have seen those emotions on display. On the streets of major cities, crowds have rallied in support of those in our country illegally. At our southern border, others have organized to stop illegal immigrants from coming in. Across the country, Americans are trying to reconcile these contrasting images. And in Washington, the debate over immigration reform has reached a time of decision. Tonight, I will make it clear where I stand, and where I want to lead our country on this vital issue. , We must begin by recognizing the problems with our immigration system. For decades, the United States has not been in complete control of its borders. As a result, many who want to work in our economy have been able to sneak across our border, and millions have stayed. , Once here, illegal immigrants live in the shadows of our society. Many use forged documents to get jobs, and that makes it difficult for employers to verify that the workers they hire are legal. Illegal immigration puts pressure on public schools and hospitals, it strains state and local budgets, and brings crime to our communities. These are real problems. Yet we must remember that the vast majority of illegal immigrants are decent people who work hard, support their families, practice their faith, and lead responsible lives. They are a part of American life, but they are beyond the reach and protection of American law. , We're a nation of laws, and we must enforce our laws. We're also a nation of immigrants, and we must uphold that tradition, which has strengthened our country in so many ways. These are not contradictory goals. America can be a lawful society and a welcoming society at the same time. We will fix the problems created by illegal immigration, and we will deliver a system that is secure, orderly, and fair. So I support comprehensive immigration reform that will accomplish five clear objectives. , First, the United States must secure its borders. This is a basic responsibility of a sovereign nation. It is also an urgent requirement of our national security. Our objective is straightforward: The border should be open to trade and lawful immigration, and shut to illegal immigrants, as well as criminals, drug dealers, and terrorists. , I was a governor of a state that has a 1,200-mile border with Mexico. So I know how difficult it is to enforce the border, and how important it is. Since I became President, we've increased funding for border security by 66 percent, and expanded the Border Patrol from about 9,000 to 12,000 agents. The men and women of our Border Patrol are doing a fine job in difficult circumstances, and over the past five years, they have apprehended and sent home about six million people entering America illegally.",['15 May 2006'],[]
http://www.americanrhetoric.com/speeches/gwbushmilitaryofficersassociation.htm,"[Thank you all very much. Thank you all. Please be seated. General Hendrix, thank you for the invitation to be here. Thanks for the kind introduction. I'm honored to stand with the men and women of the Military Officers Association of America. I appreciate the Board of Directors who are here, and the leaders who have given me this platform from which to speak. I'm proud to be here with active members of the United States military. Thank you for your service. I'm proud to be your Commander-in-Chief. I am pleased also to stand with members of the diplomatic corps, including many representing nations that have been attacked by al Qaeda and its terrorist allies since September the 11th, 2001. Your presence here reminds us that we're engaged in a global war against an enemy that threatens all civilized nations. And today the civilized world stands together to defend our freedom; we stand together to defeat the terrorists; and were working to secure the peace for generations to come. I appreciate my Attorney General joining us today, Al Gonzales. Thank you for being here. The Secretary of Homeland Security, Michael Chertoff, is with us. Three members of the United States Senate -- I might say, three important members of the United States Senate -- Senate President Pro Tem Ted Stevens of Alaska. Thank you for joining us, Senator. Chairman of the Appropriations Committee, Senator Thad Cochran of Mississippi. The Chairman of the Armed Services Committee, John Warner of Virginia. I thank Norb Ryan, as well, for his leadership. I do appreciate all the folks that are at Walter Reed who have joined us today. I'm going to tell the parents of our troops, we provide great health care to those who wear the uniform. I'm proud of those folks at Bethesda and Walter Reed -- are providing you the best possible care to help you recover from your injuries. Thank you for your courage. Thank you for joining us here today. May God bless you in your recovery. Next week, America will mark the fifth anniversary of September the 11th, 2001 terrorist attacks. As this day approaches, it brings with it a flood of painful memories. We remember the horror of watching planes fly into the World Trade Center, and seeing the towers collapse before our eyes. We remember the sight of the Pentagon, broken and in flames. We remember the rescue workers who rushed into burning buildings to save lives, knowing they might never emerge again. We remember the brave passengers who charged the cockpit of their hijacked plane, and stopped the terrorists from reaching their target and killing more innocent civilians. We remember the cold brutality of the enemy who inflicted this harm on our country -- an enemy whose leader, Osama bin Laden, declared the massacre of nearly 3,000 people that day -- I quote -- ""an unparalleled and magnificent feat of valor, unmatched by any in humankind before them."", In five years since our nation was attacked, al Qaeda and terrorists it has inspired have continued to attack across the world. They've killed the innocent in Europe and Africa and the Middle East, in Central Asia and the Far East, and beyond. Most recently, they attempted to strike again in the most ambitious plot since the attacks of September the 11th -- a plan to blow up passenger planes headed for America over the Atlantic Ocean. Five years after our nation was attacked, the terrorist danger remains. We're a nation at war -- and America and her allies are fighting this war with relentless determination across the world. Together with our coalition partners, we've removed terrorist sanctuaries, disrupted their finances, killed and captured key operatives, broken up terrorist cells in America and other nations, and stopped new attacks before they're carried out. We're on the offense against the terrorists on every battlefront -- and we'll accept nothing less than complete victory. In the five years since our nation was attacked, we've also learned a great deal about the enemy we face in this war. We've learned about them through videos and audio recordings, and letters and statements they've posted on websites. We've learned about them from captured enemy documents that the terrorists have never meant for us to see. Together, these documents and statements have given us clear insight into the mind of our enemies -- their ideology, their ambitions, and their strategy to defeat us. We know what the terrorists intend to do because they've told us -- and we need to take their words seriously. So today I'm going to describe -- in the terrorists' own words, what they believe... what they hope to accomplish, and how they intend to accomplish it. I'll discuss how the enemy has adapted in the wake of our sustained offensive against them, and the threat posed by different strains of violent Islamic radicalism. I'll explain the strategy we're pursuing to protect America, by defeating the terrorists on the battlefield, and defeating their hateful ideology in the battle of ideas. The terrorists who attacked us on September the 11th, 2001, are men without conscience -- but they're not madmen. They kill in the name of a clear and focused ideology, a set of beliefs that are evil, but not insane. These al Qaeda terrorists and those who share their ideology are violent Sunni extremists. They're driven by a radical and perverted vision of Islam that rejects tolerance, crushes all dissent, and justifies the murder of innocent men, women and children in the pursuit of political power. They hope to establish a violent political utopia across the Middle East, which they call a ""Caliphate"" -- where all would be ruled according to their hateful ideology. Osama bin Laden has called the 9/11 attacks -- in his words -- ""a great step towards the unity of Muslims and establishing the Righteous... [Caliphate]."", This caliphate would be a totalitarian Islamic empire encompassing all current and former Muslim lands, stretching from Europe to North Africa, the Middle East, and Southeast Asia. We know this because al Qaeda has told us. About two months ago, the terrorist Zawahiri -- he's al Qaeda's second in command -- declared that al Qaeda intends to impose its rule in ""every land that was a home for Islam, from [Spain] to Iraq. He went on to say, ""The whole world is an open field for us."", We know what this radical empire would look like in practice, because we saw how the radicals imposed their ideology on the people of Afghanistan. Under the rule of the Taliban and al Qaeda, Afghanistan was a totalitarian nightmare -- a land where women were imprisoned in their homes, men were beaten for missing prayer meetings, girls could not go to school, and children were forbidden the smallest pleasures like flying kites. Religious police roamed the streets, beating and detaining civilians for perceived offenses. Women were publicly whipped. Summary executions were held in Kabul's soccer stadium in front of cheering mobs. And Afghanistan was turned into a launching pad for horrific attacks against America and other parts of the civilized world -- including many Muslim nations. The goal of these Sunni extremists is to remake the entire Muslim world in their radical image. In pursuit of their imperial aims, these extremists say there can be no compromise or dialogue with those they call ""infidels"" -- a category that includes America, the world's free nations, Jews, and all Muslims who reject their extreme vision of Islam. They reject the possibility of peaceful coexistence with the free world. Again, hear the words of Osama bin Laden earlier this year: ""Death is better than living on this Earth with the unbelievers among us."", These radicals have declared their uncompromising hostility to freedom. It is foolish to think that you can negotiate with them. We see the uncompromising nature of the enemy in many captured terrorist documents. Here are just two examples: After the liberation of Afghanistan, coalition forces searching through a terrorist safe house in that country found a copy of the al Qaeda charter. This charter states that ""there will be continuing enmity until everyone believes in Allah. We will not meet [the enemy] halfway. There will be no room for dialogue with them."" Another document was found in 2000 by British police during an anti-terrorist raid in London -- a grisly al Qaeda manual that includes chapters with titles such as ""Guidelines for Beating and Killing Hostages."" This manual declares that their vision of Islam ""does not...make a truce with unbelief, but rather confronts it."" The confrontation...calls for...the dialogue of bullets, the ideals of assassination, bombing, and destruction, and the diplomacy of the cannon and machine gun."", Still other captured documents show al Qaeda's strategy for infiltrating Muslim nations, establishing terrorist enclaves, overthrowing governments, and building their totalitarian empire. We see this strategy laid out in a captured al Qaeda document found during a recent raid in Iraq, which describes their plans to infiltrate and take over Iraq's western Anbar Province. The document lays out an elaborate al Qaeda governing structure for the region that includes an Education Department, a Social Services Department, a Justice Department, and an ""Execution Unit"" responsible for ""Sorting out, Arrest, Murder, and Destruction."", According to their public statements, countries that have -- they have targeted stretch from the Middle East to Africa, to Southeast Asia. Through this strategy, al Qaeda and its allies intend to create numerous, decentralized operating bases across the world, from which they can plan new attacks, and advance their vision of a unified, totalitarian Islamic state that can confront and eventually destroy the free world. These violent extremists know that to realize this vision, they must first drive out the main obstacle that stands in their way -- the United States of America. According to al Qaeda, their strategy to defeat America has two parts: First, they're waging a campaign of terror across the world. They're targeting our forces abroad, hoping that the American people will grow tired of casualties and give up the fight. And they're targeting America's financial centers and economic infrastructure at home, hoping to terrorize us and cause our economy to collapse.",['5 September 2006'],"['Capital Hilton Hotel, Washington, D.C.']"
http://www.americanrhetoric.com/speeches/gwbushmilitarytribunalsforterrorists.htm,"[Welcome to the White House. Mr. Vice President, Secretary Rice, Attorney General Gonzales, Ambassador Negroponte, General Hayden, members of the United States Congress, families who lost loved ones in the terrorist attacks on our nation, and my fellow citizens: Thanks for coming. , On the morning of September the 11th, 2001, our nation awoke to a nightmare attack. Nineteen men, armed with box cutters, took control of airplanes and turned them into missiles. They used them to kill nearly 3,000 innocent people. We watched the Twin Towers collapse before our eyes -- and it became instantly clear that we'd entered a new world, and a dangerous new war. , The attacks of September the 11th horrified our nation. And amid the grief came new fears and urgent questions: Who had attacked us? What did they want? And what else were they planning? Americans saw the destruction the terrorists had caused in New York, and Washington, and Pennsylvania, and they wondered if there were other terrorist cells in our midst poised to strike; they wondered if there was a second wave of attacks still to come. , With the Twin Towers and the Pentagon still smoldering, our country on edge, and a stream of intelligence coming in about potential new attacks, my Administration faced immediate challenges: We had to respond to the attack on our country. We had to wage an unprecedented war against an enemy unlike any we had fought before. We had to find the terrorists hiding in America and across the world, before they were able to strike our country again. So in the early days and weeks after 9/11, I directed our government's senior national security officials to do everything in their power, within our laws, to prevent another attack. , Nearly five years have passed since these -- those initial days of shock and sadness -- and we are thankful that the terrorists have not succeeded in launching another attack on our soil. This is not for the lack of desire or determination on the part of the enemy. As the recently foiled plot in London shows, the terrorists are still active, and they're still trying to strike America, and they're still trying to kill our people. One reason the terrorists have not succeeded is because of the hard work of thousands of dedicated men and women in our government, who have toiled day and night, along with our allies, to stop the enemy from carrying out their plans. And we are grateful for these hardworking citizens of ours. Another reason the terrorists have not succeeded is because our government has changed its policies -- and given our military, intelligence, and law enforcement personnel the tools they need to fight this enemy and protect our people and preserve our freedoms. , The terrorists who declared war on America represent no nation, they defend no territory, and they wear no uniform. They do not mass armies on borders, or flotillas of warships on the high seas. They operate in the shadows of society; they send small teams of operatives to infiltrate free nations; they live quietly among their victims; they conspire in secret, and then they strike without warning. In this new war, the most important source of information on where the terrorists are hiding and what they are planning is the terrorists, themselves. Captured terrorists have unique knowledge about how terrorist networks operate. They have knowledge of where their operatives are deployed, and knowledge about what plots are underway. This intelligence -- this is intelligence that cannot be found any other place. And our security depends on getting this kind of information. To win the war on terror, we must be able to detain, question, and, when appropriate, prosecute terrorists captured here in America, and on the battlefields around the world. , After the 9/11 attacks, our coalition launched operations across the world to remove terrorist safe havens, and capture or kill terrorist operatives and leaders. Working with our allies, we've captured and detained thousands of terrorists and enemy fighters in Afghanistan, in Iraq, and other fronts of this war on terror. These enemy -- these are enemy combatants, who were waging war on our nation. We have a right under the laws of war, and we have an obligation to the American people, to detain these enemies and stop them from rejoining the battle. , Most of the enemy combatants we capture are held in Afghanistan or in Iraq, where they're questioned by our military personnel. Many are released after questioning, or turned over to local authorities -- if we determine that they do not pose a continuing threat and no longer have significant intelligence value. Others remain in American custody near the battlefield, to ensure that they don't return to the fight. , In some cases, we determine that individuals we have captured pose a significant threat, or may have intelligence that we and our allies need to have to prevent new attacks. Many are al Qaeda operatives or Taliban fighters trying to conceal their identities, and they withhold information that could save American lives. In these cases, it has been necessary to move these individuals to an environment where they can be held secretly [sic], questioned by experts, and -- when appropriate -- prosecuted for terrorist acts. , Some of these individuals are taken to the United States Naval Base at Guantanamo Bay, Cuba. It's important for Americans and others across the world to understand the kind of people held at Guantanamo. These aren't common criminals, or bystanders accidentally swept up on the battlefield -- we have in place a rigorous process to ensure those held at Guantanamo Bay belong at Guantanamo. Those held at Guantanamo include suspected bomb makers, terrorist trainers, recruiters and facilitators, and potential suicide bombers. They are in our custody so they cannot murder our people. One detainee held at Guantanamo told a questioner questioning him -- he said this: ""I'll never forget your face. I will kill you, your brothers, your mother, and sisters."" , In addition to the terrorists held at Guantanamo, a small number of suspected terrorist leaders and operatives captured during the war have been held and questioned outside the United States, in a separate program operated by the Central Intelligence Agency. This group includes individuals believed to be the key architects of the September the 11th attacks, and attacks on the USS Cole, an operative involved in the bombings of our embassies in Kenya and Tanzania, and individuals involved in other attacks that have taken the lives of innocent civilians across the world. These are dangerous men with unparalleled knowledge about terrorist networks and their plans for new attacks. The security of our nation and the lives of our citizens depend on our ability to learn what these terrorists know. , Many specifics of this program, including where these detainees have been held and the details of their confinement, cannot be divulged. Doing so would provide our enemies with information they could use to take retribution against our allies and harm our country. I can say that questioning the detainees in this program has given us information that has saved innocent lives by helping us stop new attacks -- here in the United States and across the world. Today, I'm going to share with you some of the examples provided by our intelligence community of how this program has saved lives; why it remains vital to the security of the United States, and our friends and allies; and why it deserves the support of the United States Congress and the American people. , Within months of September the 11th, 2001, we captured a man known as Abu Zubaydah. We believe that Zubaydah was a senior terrorist leader and a trusted associate of Osama bin Laden. Our intelligence community believes he had run a terrorist camp in Afghanistan where some of the 9/11 hijackers trained, and that he helped smuggle al Qaeda leaders out of Afghanistan after coalition forces arrived to liberate that country. Zubaydah was severely wounded during the firefight that brought him into custody -- and he survived only because of the medical care arranged by the CIA. , After he recovered, Zubaydah was defiant and evasive. He declared his hatred of America. During questioning, he at first disclosed what he thought was nominal information -- and then stopped all cooperation. Well, in fact, the ""nominal"" information he gave us turned out to be quite important. For example, Zubaydah disclosed Khalid Sheikh Mohammed -- or KSM -- was the mastermind behind the 9/11 attacks, and used the alias ""Muktar."" This was a vital piece of the puzzle that helped our intelligence community pursue KSM. Abu Zubaydah also provided information that helped stop a terrorist attack being planned for inside the United States -- an attack about which we had no previous information. Zubaydah told us that al Qaeda operatives were planning to launch an attack in the U.S. and provided physical descriptions of the operatives and information on their general location. Based on the information he provided, the operatives were detained -- one while traveling to the United States. We knew that Zubaydah had more information that could save innocent lives, but he stopped talking. As his questioning proceeded, it became clear that he had received training on how to resist interrogation. And so the CIA used an alternative set of procedures. These procedures were designed to be safe, to comply with our laws, our Constitution, and our treaty obligations. The Department of Justice reviewed the authorized methods extensively and determined them to be lawful. I cannot describe the specific methods used -- I think you understand why -- if I did, it would help the terrorists learn how to resist questioning, and to keep information from us that we need to prevent new attacks on our country. But I can say the procedures were tough, and they were safe, and lawful, and necessary. , Zubaydah was questioned using these procedures, and soon he began to provide information on key al Qaeda operatives, including information that helped us find and capture more of those responsible for the attacks on September the 11th. For example, Zubaydah identified one of KSM's accomplices in the 9/11 attacks -- a terrorist named Ramzi bin al Shibh. The information Zubaydah provided helped lead to the capture of bin al Shibh. And together these two terrorists provided information that helped in the planning and execution of the operation that captured Khalid Sheikh Mohammed. , Once in our custody, KSM was questioned by the CIA using these procedures, and he soon provided information that helped us stop another planned attack on the United States. During questioning, KSM told us about another al Qaeda operative he knew was in CIA custody -- a terrorist named Majid Khan. KSM revealed that Khan had been told to deliver $50,000 to individuals working for a suspected terrorist leader named Hambali, the leader of al Qaeda's Southeast Asian affiliate known as ""J-I"". CIA officers confronted Khan with this information. Khan confirmed that the money had been delivered to an operative named Zubair, and provided both a physical description and contact number for this operative.",['6 September 2006'],"['White House, Washington, D.C.']"
